id,date,source,url,title,content,authors,summary
29,2025-10-01,www.kompas.com,https://www.kompas.com/kalimantan-timur/read/2025/10/01/194431788/10-prompt-gemini-ai-untuk-edit-foto-berdua-dengan-tema-hari,10 Prompt Gemini AI untuk Edit Foto Berdua dengan Tema Hari Batik Nasional yang Estetik,"KOMPAS.com - Kumpulan prompt Gemini AI berikut bisa digunakan untuk mengedit foto berdua dengan tema Hari Batik Nasional yang diperingati setiap 2 Oktober.

Dengan menuliskan prompt yang tepat, pengguna dapat membuat potret diri bersama pasangan atau sahabat menggunakan batik dalam berbagai suasana saat perayaan Hari Batik Nasional.

Hasil edit bisa menampilkan gaya santai penuh kehangatan, hingga penampilan lebih tegas dan meyakinkan bak model majalah fashion. Semua tergantung kreativitas dan detail deskripsi yang dimasukkan.

Baca juga: 10 Prompt Gemini AI untuk Edit Foto Berhijab dengan Tema Hari Batik Nasional yang Estetik dan Realistis

Cara Edit Foto dengan Prompt Gemini AI

Mengedit foto menggunakan Gemini AI sangatlah praktis dan bisa dilakukan siapa saja. Berikut langkah-langkahnya:

Buka aplikasi atau situs resmi Gemini AI di perangkat Anda. Pilih menu gambar atau image generation. Unggah foto yang ingin diedit dengan menekan tombol upload atau ikon gambar. Masukkan prompt sesuai instruksi, seperti gaya busana, warna latar belakang, atau pencahayaan. Tekan tombol generate dan tunggu beberapa saat hingga hasil edit muncul sesuai deskripsi.

Baca juga: 10 Prompt Gemini AI untuk Edit Foto Tema Hari Batik Nasional dengan Berbagai Gaya

Contoh Prompt Gemini AI untuk Tema Hari Batik Nasional

Berikut beberapa contoh prompt Gemini AI dalam bahasa Indonesia yang bisa digunakan untuk menghasilkan foto estetik di Hari Batik Nasional:

1. Gaya Pasangan Formal di Studio

“Ubah foto ini menjadi potret close up pasangan mengenakan batik formal. Laki-laki memakai batik lengan panjang warna cokelat dengan motif garuda, celana kain hitam, sepatu kulit mengilap, duduk di kursi kayu dengan posisi sedikit miring, tangan di pangkuan. Perempuan memakai kebaya batik modern dengan rok lilit batik warna senada, berselempang satin krem elegan, aksesori bros emas di bahu, berdiri di samping kursi sambil menyentuhkan tangan di bahu pasangan, senyum hangat. Background polos warna abu-abu gelap dengan pencahayaan studio dramatis, tone hangat, bayangan halus, suasana resmi dan berwibawa.”

2. Gaya Pasangan Formal di Suasana Heritage

“Edit foto menjadi foto pasangan mengenakan batik di area alun-alun kota bernuanasa heritage. Laki-laki memakai kemeja batik biru-hitam bermotif kawung, celana chino beige, jam tangan kulit cokelat, berdiri dengan tangan di saku dan ekspresi percaya diri. Perempuan memakai dress batik kontemporer warna biru dengan aksen songket di bagian pinggang, hijab chiffon krem, memegang tas anyaman kecil, berdiri di samping sambil tersenyum ke kamera. Background berupa pohon beringin besar dan bangunan kolonial dengan cahaya golden hour, tone hangat kekuningan, bayangan jatuh natural, suasana santai dan berkelas.”

3. Gaya Pasangan Editorial Fashion Majalah

“Edit foto menjad foto menjadi gaya editorial majalah fashion. Laki-laki memakai setelan jas hitam dipadukan dengan kemeja batik merah marun motif megamendung, pose berdiri tegap dengan satu tangan menyelip di saku celana. Perempuan memakai gaun batik kontemporer potongan modern dengan detail payet, rambut tergerai ditata rapi, mengenakan anting panjang emas, tangan di pinggang dengan ekspresi fierce. Background dinding beton industrial abu-abu dengan pencahayaan spotlight dramatis, bayangan tegas, tone kontras tajam bergaya editorial.”

4. Couple Santai di Taman Kota

“Ubah foto ini menjadi pasangan muda mengenakan batik kasual. Laki-laki memakai batik pendek warna hijau dengan motif flora, dipadukan jeans biru muda dan sneakers putih, duduk di bangku taman sambil tertawa. Perempuan memakai tunik batik warna senada dengan ikat pinggang sederhana, dengan bando pastel lembut, membawa buket bunga kecil, duduk di sampingnya sambil tersenyum ke arah pasangan. Background taman dengan pepohonan hijau dan bunga warna-warni, cahaya matahari sore lembut, tone natural hangat, nuansa ceria dan romantis.”

5. Gaya Pasangan Efek Polaroid Estetik

“Edit foto ini menjadi gaya polaroid estetik. Laki-laki memakai batik hitam-cokelat motif parang, duduk di lantai dengan posisi santai, tangan menyangga lutut. Perempuan memakai batik dress sederhana warna cokelat muda, hijab krem polos, memakai gelang kayu, duduk di samping sambil menyandarkan kepala di bahu pasangan dengan senyum tipis. Background tirai putih tipis dengan cahaya natural yang masuk dari jendela, filter hangat vintage khas polaroid, tone intim, nuansa sederhana namun penuh kehangatan.”

6. Gaya dengan Sahabat di Kantor

“Ubah foto ini menjadi potret candid dua sahabat wanita di dalam kantor modern. Keduanya mengenakan setelan batik berbeda warna, celana kain rapi, sepatu formal, satu duduk bersebelahan di kursi meeting sambil memegang pena, satunya berdiri menunjuk ke layar komputer. Salah satu tersenyum ke arah kamera, yang lain sedang menunjuk layar laptop dengan ekspresi serius. Background ruangan kantor dengan kubikel, rak buku, dan pencahayaan putih netral. Tone foto profesional, suasana formal namun akrab.”

7. Gaya Santai di Kafe dengan Sahabat

“Edit foto menjadi dua sahabat duduk di kafe estetik. Satu orang memakai batik tanpa lengan warna biru dan celana jeans, memegang cangkir kopi panas sambil tertawa. Sahabat lainnya memakai blus batik modern dengan celana kulot hitam, menikmati satu slice kue strawbery di piring kecil. Background interior kafe dengan jendela kaca besar, dekorasi tanaman hias, cahaya sore masuk ke dalam ruangan. Tone hangat cozy, nuansa santai penuh keakraban.”

8. Gaya Foto Outdoor di Taman Kota

“Edit foto menjadi dua sahabat sedang berjalan bersama di taman kota. Keduanya memakai outfit batik kasual— atasan batik tanpa lengan, celana jeans, sneakers. Salah satu sahabat membawa kamera DSLR, yang lain membawa totebag kanvas etnik. Background jalan setapak dengan pepohonan rindang dan bunga warna-warni, pencahayaan golden hour sore hari. Tone cerah natural, nuansa ceria dan penuh energi persahabatan.”

9. Gaya Editorial Fashion dengan Sahabat

“Ubah foto ini menjadi dua sahabat berpose editorial ala majalah fashion. Satu orang memakai blazer batik oversized warna abu-abu dengan inner dress hitam dan high heels hitam. Sahabat lainnya memakai dress batik modern couture potongan asimetris dengan aksen ikat pinggang kulit. Keduanya berdiri berpose di studio dengan pencahayaan spotlight kontras, ekspresi fierce tanpa senyum. Background dinding polos putih gradasi abu-abu dengan bayangan dramatis. Tone foto tajam, nuansa high-fashion.”

10. Gaya Polaroid Vintage dengan Sahabat

“Edit foto menjadi dua sahabat duduk lesehan di kamar tidur dengan gaya polaroid estetik. Satu orang memakai batik dress, duduk sambil memegang gitar akustik. Sahabat lain memakai kemeja batik model peplum, duduk sambil memegang boneka bersandar ke beanbag. Background tirai putih tipis dengan cahaya matahari pagi masuk lembut. Filter polaroid klasik dengan warna agak pudar. Tone hangat, nuansa intim dan nostalgic.”","Kompas Cyber Media, Gemini Ai",Kumpulan prompt Gemini AI dalam bahasa Indonesia untuk edit foto berdua mengenakan batik dengan gaya estetik untuk diunggah di Hari Batik Nasional.
30,2025-10-01,tekno.kompas.com,https://tekno.kompas.com/read/2025/10/01/18320037/uji-coba-edit-foto-di-jepang-pakai-ai-gemini-nano-banana-hasilnya-realistis,"Uji Coba Edit Foto di Jepang Pakai AI Gemini Nano Banana, Hasilnya Realistis","TOKYO, KOMPAS.com - Menggunakan model kecerdasan buatan (artificial intelligence/AI) Google Nano Banana menjadi tren baru di media sosial. Banyak pengguna yang menjajal model image editing terbaru Google DeepMind di aplikasi Gemini ini.

Kehadiran Google DeepMind di Gemini memungkinkan pengguna berkreasi sebebas-bebasnya untuk mengedit foto sesuai keinginan. Model ini juga disebut-sebut mampu menjaga konsistensi wajah, karakter, dan objek sekitar meski sudah melalui banyak perubahan.

Untuk menguji kebolehan dari fitur ini, jurnalis KOMPAS.com, Caroline Saskia Tanoto dan Bill Clinten berkesempatan untuk mengedit hasil foto selfie yang diabadikan di pinggir kota Tokyo, Jepang, yakni Kichijoji Park.

Lokasi pengambilan foto selfie ini dilakukan di jembatan sumber air Taman Inkashira. Nuansa pengambilan foto saat itu hanya didominasi warna hijau dari air dan pepohonan rindang di sepanjang jalanan. Ditambah, suasana langit saat itu cukup sendu, berawan, sehingga warna langit tampak pucat.

Baca juga: Saat Gemini AI Jadi Tour Guide Live Keliling Taman di Kichijoji Jepang

Kami pun menguji kemampuan Google Deep Mind untuk mengedit suasana dari selfie tersebut. Prompt yang kami gunakan saat itu adalah sebagai berikut.

Ini adalah foto saya di depan sungai Kichijoji (Inokashira) Tokyo. Buat foto di jembatan ini diganti dengan air mancur yang sinematik dengan suasana cahaya sunset.

Hanya butuh beberapa detik mempelajari prompt yang dikirim, Gemini langsung mengedit gambar tersebut sesuai dengan prompt yang dibutuhkan. Berikut adalah contoh hasil sebelum dan sesudah diedit menggunakan fitur Gemini DeepMind.

KOMPAS.com/Caroline Saskia Tanoto (kiri-kanan) Hasil sebelum dan sesudah diedit menggunakan Google DeepMind yang sudah terintegrasi di aplikasi Gemini. Lokasi selfie diambil di jembatan sungai Inokashira, Kichijoji, Tokyo, Jepang (kiri-kanan) Hasil sebelum dan sesudah diedit menggunakan Google DeepMind yang sudah terintegrasi di aplikasi Gemini. Lokasi selfie diambil di jembatan sungai Inokashira, Kichijoji, Tokyo, Jepang

Hasil editan yang dibuat oleh Google bisa dikatakan apik. Sebab, wajah versi asli dan editan tidak berubah sedikitpun.

Umumnya, ketika mengirim gambar ke chatbot AI, akan ada sedikit perubahan di bagian wajah. Namun, Google DeepMind mampu mempertahankan mana objek atau bagian tertentu dari gambar yang perlu dipertahankan dan tidak.

Sesuai dengan prompt untuk memberi suasana cahaya sunset, gambar kini didominasi oleh warna kuning dan jingga seperti langit senja. Ada pula cahaya flare yang menyelinap di balik pepohonan dan air mancur. Awan di langit dipertegas seperti langit di sore hari.

Menurut kami, penambahan objek air mancur yang mendadak muncul di tengah sungai cukup realistis. Google DeepMind mampu menggambarkan detail dari pancuan air yang keluar dan kembali ke sungai.

Penempatan air mancur di atas air juga tergambarkan cukup baik dengan detail yang realistis. Hasilnya sekilas tampak seperti foto asli.

Sebab, pada bagian bawah air mancur yang bersentuhan dengan air diberi tambahan efek shadow, highlight diturunkan, dan kontras yang ditambah.

Tidak sampai di sana, hasil editan foto yang dilakukan juga memiliki kualitas yang cukup tinggi. Padahal, prompt yang kami tulis sebelumnya tidak mencantumkan soal permintaan resolusi tinggi, seperti ""High-realistic results"" atau ""gambar beresolusi tinggi"", dan sebagainya.

Hanya saja, menurut kami, warna yang ditampilkan terlalu dominan dan memiliki saturasi yang terlalu tinggi. Jika dilihat lebih lama, hasilnya seperti editan karena tampaknya ada penambahan filter warna tertentu.

Guna mengantisipasi hasil gambar yang direkayasa ini disalahgunakan, Gemini akan menambahkan logo Gemini, seperti bintang di pojok kanan bawah gambar. Penambahan logo ini menunjukkan bahwa hasil foto tersebut sudah disunting, ""dipermak"" oleh bantuan Google Deep Mind.

Untuk tutorial dan pengalaman kami menjajal fitur ini bisa dilihat melalui video berikut ini.

Baca juga: 20 Contoh Prompt Gemini AI untuk Gabung Foto Masa Kecil dan Dewasa

View this post on Instagram A post shared by Tekno Kompas.com (@teknokompas)

Jangan lupa follow KompasTekno untuk dapat informasi terkini soal teknologi dan gadget lainnya.","Kompas Cyber Media, Caroline Saskia, Yudha Pratomo, Kompas.Com Caroline Saskia Tanoto","Hasil editan yang dibuat oleh Google bisa dikatakan apik. Sebab, wajah versi asli dan editan tidak berubah sedikitpun."
31,2025-10-01,tekno.kompas.com,https://tekno.kompas.com/read/2025/10/01/18040037/anthropic-rilis-ai-claude-sonnet-4.5-bisa-coding-30-jam-nonstop,"Anthropic Rilis AI Claude Sonnet 4.5, Bisa ""Coding"" 30 Jam Nonstop","KOMPAS.com - Perusahaan kecerdasan buatan (AI) asal Amerika Serikat, Antropchic, merilis model AI terbaru mereka yang dirancang khusus untuk membantu melakukan coding atau pengkodean. Model bernama Claude Sonet 4.5 ini meluncur pada Senin (15/9/2025).

Claude Sonet 4.5 merupakan suksesor dari model AI Claude Sonnet 4 yang dirilis pada Mei 2025 lalu. Antrophic menyebut, model AI anyarnya ini hadir dengan menawarkan performa terdepan dalam berbagai tolok ukur (benchmark) coding.

Anthropic Anthropic meluncurkan model AI baru bernama Claude Sonnet 4.5 pada Senin (15/9/2025). Model ini ini dirancang khusus untuk koding dan diklaim mampu menghasilkan aplikasi siap produksi, bukan hanya sekadar prototipe. Anthropic meluncurkan model AI baru bernama Claude Sonnet 4.5 pada Senin (15/9/2025). Model ini ini dirancang khusus untuk koding dan diklaim mampu menghasilkan aplikasi siap produksi, bukan hanya sekadar prototipe.

Menurut perusahaan, pada tes benchmark pengkodingan SWE-Bench Verified, Claude Sonnet 4.5 berhasil mencatatkan kinerja paling unggul dibanding dengan model AI Opus 4.1, Sonnet 4, GPT-5 Codex milik OpenAI, GPT-5, hingga Gemini 2.5 Pro buatan Google.

Meski demikian, peneliti AI Anthropic, David Hershey, menyatakan bahwa hasil tes benchmark saja sebenarnya masih belum cukup untuk menggambarkan keseluruhan kemampuan Sonnet 4.5.

Baca juga: OpenAI Rilis GPT-5-Codex, Model AI Khusus Coding Otomatis

Bisa coding 30 jam nonstop

Menurut Hershey, kemampuan Claude Sonnet 4.5 justru lebih menonjol saat digunakan langsung. Sepengalaman Hershey sendiri dalam uji coba bersama klien perusahaan, model AI ini disebut mampu melakukan coding secara mandiri hingga 30 jam nonstop.

Selama proses tersebut, kata Hershey, Claude Sonnet 4.5 bahkan tidak hanya melakukan tugas menulis kode, tapi juga menjalankan layanan database, membeli nama domain, hingga mengerjakan audit SOC 2 untuk memastikan keamanan produk.

Kemampuan tersebut lantas membuat sejumlah startup teknologi memberikan tanggapan positif. Perusahaan Cursor, misalnya, sang CEO Michael Truell menilai bahwa Claude Sonnet 4.5 sudah mencerminkan standar tertinggi model AI untuk koding saat ini.

Ia mengatakan, keunggulan Claude Sonnet 4.5 paling terlihat saat diminta menangani proyek dengan durasi panjang.

Anthropic Tes benchmark pengkodingan SWE-Bench Verified, Claude Sonnet 4.5 berhasil mencatatkan kinerja paling unggul dibanding dengan model AI Opus 4.1, Sonnet 4, GPT-5 Codex milik OpenAI, GPT-5, hingga Gemini 2.5 Pro buatan Google. Tes benchmark pengkodingan SWE-Bench Verified, Claude Sonnet 4.5 berhasil mencatatkan kinerja paling unggul dibanding dengan model AI Opus 4.1, Sonnet 4, GPT-5 Codex milik OpenAI, GPT-5, hingga Gemini 2.5 Pro buatan Google.

Pujian serupa juga datang dari CEO Windsurf, Jeff Wang. Ia menyebut Claude Sonnet 4.5 ini sebagai generasi baru model AI dalam tugas pengkodingan saat ini.

Anthropic sendiri mengeklaim bahwa model AI anyarnya ini merupakan model frontier mereka yang paling selaras (aligned).

Pasalnya, Claude Sonnet 4.5 dibekali kemampuan canggih di mana tingkat kecenderungan terhadap sikap menyanjung berlebihan dibuat lebih rendah dan minim memberikan jawaban menyesatkan.

Selain itu, Anthropic menekankan bahwa perusahaan telah meningkatkan kerentanan Claude Sonnet 4.5 terhadap serangan prompt injection, sebagaimana dihimpun KompasTekno dari Techcrunch, Rabu (1/10/2025).

Harga Claude Sonnet 4.5

Model AI Claude Sonnet 4.5 resmi tersedia dan bisa diakses melalui Claude API maupun chatbot resmi Claude. Untuk harga, pengguna perlu membayar sekitar 3 dollar AS (sekitar Rp 50.104) per 1 juta input token (sekitar 750.000 kata).

Baca juga: Microsoft Rilis Agent Mode, Word dan Excel Bisa Nulis dan Hitung Sendiri Pakai AI

Sementara itu, untuk per 1 juta ouput token banderol harganya lebih mahal yaitu 15 dollar AS (sekitar Rp 250.410).

Claude Sonnet 4.5 sendiri diluncurkan kurang dari dua bulan setelah perusahaan merilis Claude Opus 4.1.

Rilis model AI lain

Bersamaan dengan peluncuran Claude Sonnet 4.5, Antrophic juga diketahui merilis model AI lain bernama Claude Agent SDK.

Perusahaan mengeklaim bahwa ini adalah infrastruktur yang sama yang mendukung Claude Code dan dapat digunakan untuk membantu pengembang membangun agen AI mereka sendiri.","Kompas Cyber Media, Marsha Bremanda, Yudha Pratomo, Freepik","Menurut hasil benchmark, model AI ini mengalahkan GPT-5 Codex dari OpenAI yang juga dibuat khusus untuk coding."
32,2025-10-01,www.kompas.com,https://www.kompas.com/kalimantan-timur/read/2025/10/01/174732088/10-prompt-gemini-ai-untuk-edit-foto-maternity-kehamilan-yang,"10 Prompt Gemini AI untuk Edit Foto Maternity Kehamilan yang Estetik, Realistis, dan Elegan","KOMPAS.com - Kumpulan prompt Gemini AI dalam bahasa Indonesia bisa dimanfaatkan ibu hamil untuk membuat foto maternity atau maternity shoot dengan berbagai gaya menarik yang siap diunggah ke media sosial.

Tidak hanya untuk gaya kasual atau hobi, kini banyak calon ibu juga memanfaatkan teknologi ini untuk mengabadikan momen istimewa masa kehamilan dengan hasil estetik.

Dengan menuliskan deskripsi yang tepat, foto kehamilan dapat diedit menjadi potret penuh makna, mulai dari gaya elegan di studio, nuansa natural di alam terbuka, hingga sentuhan editorial modern dengan pencahayaan dramatis.

Tak heran jika semakin banyak ibu hamil maupun kreator konten yang mencoba tren ini untuk mempercantik unggahan, baik sebagai dokumentasi pribadi, inspirasi gaya kehamilan, maupun karya artistik bernuansa editorial.

Baca juga: 10 Prompt Gemini AI untuk Edit Foto Berhijab dengan Tema Hari Batik Nasional yang Estetik dan Realistis

Cara Edit Foto Maternity dengan Gemini AI

Mengedit foto maternity menggunakan Gemini AI sangat praktis dan bisa dilakukan siapa saja. Ikuti langkah berikut agar hasil edit sesuai keinginan:

Buka aplikasi atau situs resmi Gemini AI di perangkat Anda. Pilih menu gambar/image generation untuk memulai proses. Unggah foto yang ingin diedit dengan menekan tombol upload atau ikon gambar. Masukkan prompt sesuai deskripsi yang diinginkan, seperti gaya, suasana, pencahayaan, hingga ekspresi. Tekan tombol generate dan tunggu beberapa detik hingga hasil edit muncul sesuai instruksi.

Baca juga: 10 Prompt Gemini AI untuk Edit Foto Polaroid dengan Idol Kpop, Bisa Ganti Pose-pose Gemas

Contoh Prompt Gemini AI untuk Edit Foto Maternity

Berikut beberapa contoh prompt Gemini AI dalam bahasa Indonesia yang bisa Anda gunakan untuk menghasilkan foto maternity elegan dan estetik:

1. Gaya Foto Maternity dengan Foto USG

“Ubah foto ini menjadi foto bergaya maternity, jangan ubah wajah asli. Pose ibu hamil duduk bersila di atas karpet krem sambil memegang foto hasil USG di depan perut dengan ekspresi hangat penuh cinta. Pakaian kaos lengan panjang sederhana warna pastel biru dan celana jeans oversized. Background studio polos warna putih lembut dengan pencahayaan natural soft. Tone hangat dengan filter natural family look, tambahkan properti mainan bayi berserakan di karpet sebagai aksen agar lebih aesthetik.”

2. Gaya Close Up Elegan

“Ubah foto ini menjadi foto bergaya close up ibu hamil tampak serong samping, jangan ubah bentuk wajah asli. Pose wajah menatap perut dengan senyum hangat penuh kasih, hijab atau rambut ditata rapi tanpa helai berantakan. Pakaian gaun maternity sederhana warna pastel pink lembut. Latar belakang polos warna pastel dengan pencahayaan studio lembut. Tone hangat natural dengan filter halus, tambahkan properti bunga kecil di tangan untuk kesan lebih manis.”

3. Foto Bersama Pasangan

“Ubah foto ini menjadi foto bergaya maternity couple, jangan ubah bentuk wajah asli. Pose close up suami berdiri di belakang istri sambil merangkul lembut perut, keduanya menatap ke arah kamera dengan senyum hangat. Pakaian: istri mengenakan gaun maternity elegan warna pink lembut, suami mengenakan kemeja putih dan celana panjang khaki. Background studio polos pink muda dengan pencahayaan romantis lembut. Tone warm intim dengan filter klasik, tambahkan properti buket bunga warna warni untuk kesan studio lebih realistis.”

4. Foto Maternity di Pantai

“Ubah foto ini menjadi foto bergaya maternity outdoor, jangan ubah wajah asli. Pose full body ibu hamil berdiri di tepi pantai sambil menatap horizon dengan senyum lembut, satu tangan memegang perut dan satu tangan memegang topi jerami. Pakaian maxi dress putih flowy yang melambai diterpa angin. Background pantai dengan langit cerah biru keemasan saat golden hour. Tone warm natural dengan filter cinematic sunset, tambahkan efek kaki dan bagian bawah gaun tersapu ombak kecil agar lebih realistis.”

5. Foto Maternity Dress Sexy Elegan

“Ubah foto ini menjadi foto bergaya maternity editorial elegan, jangan ubah wajah asli. Pose ibu hamil duduk anggun di kursi dengan bahu terbuka mengenakan maternity dress seksi warna hitam off shouldher berbahan satin, namun tetap elegan. Mengenakan perhiasan berlian. Background studio polos merah dengan pencahayaan spotlight dramatis. Tone glamor elegan dengan filter high fashion, tambahkan properti buket mawar merah besar dengan kelopak yang berserakan di lantai untuk kesan mewah.”

6. Foto Maternity di Taman Bunga

“Ubah foto ini menjadi foto bergaya maternity outdoor, jangan ubah wajah asli. Pose ibu hamil duduk di karpet piknik di tengah taman bunga berwarna-warni, tangan lembut memegang perut sambil menatap ke samping. Pakaian gaun maternity kuning pastel perenda kecil, hijab atau rambut ditata rapi. Background hamparan bunga dengan berwarna-warni pencahayaan daylight cerah. Tone fresh colorful dengan filter vibrant natural, tambahkan properti buket bunga di samping, serta keranjang piknik berisi buah-buahan agar lebih manis.”

7. Foto Maternity Gaya Supermodel

“Ubah foto ini menjadi foto bergaya maternity editorial supermodel, jangan ubah wajah asli. Pose full body dengan langkah percaya diri, ekspresi wajah confident dan stylish. Angle kamera agak menyamping dengan efek dramatis motion. Pakaian maternity dress modern high fashion dengan belahan rok panjang dan detail glamor. Background studio abu-abu terang minimalis dengan pencahayaan dramatis high contrast. Tone fashion-forward dengan filter editorial magazine, tambahkan efek gaun dan rambut tampak tertiup angin dari satu sisi.”

8. Foto Maternity Full Body Outdoor

“Ubah foto ini menjadi foto bergaya full body ibu hamil, jangan ubah bentuk wajah asli. Pose berdiri anggun di padang rumput saat golden hour, satu tangan memegang perut dan satu tangan memegang buket bunga liar. Pakaian berupa gaun flowy putih selutut yang melambai diterpa angin. Background padang rumput dengan cahaya matahari keemasan. Tone golden warm dengan filter natural outdoor, tambahkan properti bunga liar dan rumput ilalang agar lebih realistis.”

9. Foto Maternity Gaya Polaroid Estetik

“Ubah foto ini menjadi foto bergaya polaroid estetik, jangan ubah bentuk wajah asli. Pose ibu hamil setengah badan sedang berdiri di dekat jendela full kaca dengan tirai putih trasnparan. Pakaian piyama satin warna biru muda yang casual elegan. Background interior rumah minimalis dengan pencahayaan natural daylight masuk dari jendela. Tone hangat intim dengan filter khas polaroid (grain tipis dan frame polaroid putih).”

10. Foto Maternity Motion dengan Gaun Berkibar

“Ubah foto ini menjadi foto bergaya maternity artistic, jangan ubah wajah asli. Pose ibu hamil rebahan elegan di permukaan air tenang, wajah menatap ke kamera dengan ekspresi lembut. Pakaian gaun maternity tipis berwarna putih atau pastel yang tampak basah menempel tubuh. Make up wet look natural glam, rambut sedikit basah tertata rapi. Background air berkilau dengan refleksi cahaya lembut. Tone dreamy artistic dengan filter cinematic soft. Tambahkan properti bunga-bunga berwarna pastel yang mengapung di sekeliling tubuh untuk menambah kesan magis dan romantis.”","Kompas Cyber Media, Gemini Ai",Kumpulan prompt Gemini AI dalam bahasa Indonesia untuk edit foto maternity atau fase kehamilan dengan berbagai gaya untuk diunggah di media sosial.
