id,date,source,url,title,content,authors,summary
38,2025-10-01,www.kompas.com,https://www.kompas.com/hype/read/2025/10/01/103927366/pasang-foto-ai-bersama-glenn-fredly-gewa-happy-birthday-in-heaven-ayah,"Pasang Foto Ai Bersama Glenn Fredly, Gewa: Happy Birthday In Heaven Ayah","JAKARTA, KOMPAS.com - Putri mendiang musisi Glenn Fredly, Gewa Atlana Syamayim Latuihamallo, membagikan unggahan menyentuh di media sosial untuk memperingati hari ulang tahun sang ayah pada 30 September 2025.

Melalui akun Instagram @gewaatlanasyamayim, Gewa mengunggah beberapa potret dirinya bersama Glenn Fredly.

Baca juga: Pilih Tetap Sendiri Sejak Glenn Fredly Meninggal 5 Tahun Lalu, Mutia Ayu: Belum Bisa

Dalam foto-foto tersebut, keduanya terlihat tersenyum hangat ke arah kamera.

""Happy Birthday in Heaven Ayah @glennfredly309. Gewa dan Mage sayang dan kangen Ayah,"" tulis Gewa dalam keterangan unggahannya di Instagram, disertai emoji hati merah, dikutip Kompas.com, Rabu (1/9/2025).

View this post on Instagram A post shared by GEWA ATLANA (@gewaatlanasyamayim)

Unggahan tersebut langsung mendapat banyak respons dari sahabat artis ayahnya serta warganet yang ikut mengirimkan doa serta ucapan ulang tahun untuk Glenn Fredly.

Seperti Tompi, Yuni Shara, dan Lukman Sardi yang memberikan komentar tanda hati merah.

""Gewa campuran sempurna dari mama dan papa, cantik dan menawan,"" tulis Olga Lydia.

Baca juga: Duet dengan Glenn Fredly di Soundsfest 2025, Mutia Ayu: Ini Spesial

""Selamat ulang tahun di surga bung Glenn. Suka sekali mendengar lagu bung Glenn, terima kasih sudah menciptakan lagu yang indah dan menyentuh hati bung,"" tulis @aurelcarissa21.

""MasyaAllah Tabarakallah.... merinding liat foto-foto Gewa & Ayah Glenn... serasa nyata,"" tulis @dianvasco.

Glenn Fredly sendiri meninggal dunia pada 8 April 2020 akibat penyakit meningitis.

Ia meninggalkan seorang istri, Mutia Ayu, serta putri semata wayangnya, Gewa.

Hingga kini, karya-karya Glenn Fredly masih terus dikenang dan dicintai para penggemar musik Indonesia.","Kompas Cyber Media, Cynthia Lova, Ira Gita Natalia Sembiring",Gewa Atlana memperingati ulang tahun Glenn Fredly dengan foto-foto kenangan yang mengharukan.
39,2025-10-01,tekno.kompas.com,https://tekno.kompas.com/read/2025/10/01/10040067/openai-rilis-sora-2-model-ai-pembuat-video-realistis-yang-paham-hukum-fisika,"OpenAI Rilis Sora 2, Model AI Pembuat Video Realistis yang Paham Hukum Fisika","KOMPAS.com - Induk ChatGPT, OpenAI, merilis model kecerdasan buatan terbarunya, Sora 2, pada Selasa (30/9/2025). Model kecerdasan buatan (artificial intelligence/AI) ini lebih canggih untuk membuat video dan audio.

CEO OpenAI, Sam Altman, mengatakan bahwa peluncuran Sora 2 merupakan momen besar yang bisa disejajarkan dengan kehadiran ChatGPT, tetapi kali ini untuk dunia kreativitas.

""Ada sesuatu yang menyenangkan dari proses membuat ide cepat berubah menjadi hasil nyata. Kreativitas bisa segera meledak, membawa peningkatan besar pada seni dan hiburan,"" kata bos ChatGPT di blog pribadinya.

Model AI Sora 2 dirilis bersamaan dengan aplikasi ""media sosial"" AI bernama Sora yang diluncurkan untuk iPhone.

Aplikasi ini sekilas mirip TikTok, dengan tampilan video pendek yang bisa digulir. Namun. ada satu perbedaan besar, yakni semua kontennya sepenuhnya dihasilkan oleh AI Sora.

Baca juga: OpenAI Rilis Sora, Aplikasi Mirip TikTok Berisi Video Buatan AI

Sora 2 diklaim lebih realistis

OpenAI OpenAI kembali membuat gebrakan dengan meluncurkan Sora 2, model kecerdasan buatan (artificial intelligence/AI) terbaru dan lebih canggih untuk membuat video dan audio. OpenAI kembali membuat gebrakan dengan meluncurkan Sora 2, model kecerdasan buatan (artificial intelligence/AI) terbaru dan lebih canggih untuk membuat video dan audio.

OpenAI merilis Sora generasi pertama pada awal Desember 2024. Selang 10 bulan, Sora 2 lahir.

Menurut tim Sora, model AI Sora 2 datang dengan peningkatan yang jauh lebih signifikan. Salah satu keunggulan terbesarnya ada pada cara model ini memahami hukum fisika dalam dunia nyata.

Pada Sora generasi lama, objek video yang dihasilkan kadang tidak masuk akal, misalnya bola basket yang tiba-tiba ""teleport"" ke dalam ring meski gagal dilempar.

Kini, Sora 2 diklaim mampu membuat skenario lebih alami. Saat bola yang gagal masuk ring, maka bola akan memantul ke papan pantul atau jatuh sesuai gravitasi.

Kemampuan ini membuat hasil video bikinan Sora 2 terasa lebih realistis dan meyakinkan. OpenAI menunjukkan contoh-contoh hasil video bilinan Sora 2 yang beragam.

Mulai dari adegan pemain skateboard yang melakukan trik sulit, rutinitas senam yang detail, atlet figure skating yang melakukan trik dengan kucing, peselancar yang mendarat dengan gaya akrobatik, koboi menunggang dua kuda sekaligus, hingga video ala anime (animasi Jepang).

Selain lebih realistis secara fisik, Sora 2 juga jauh lebih baik dalam menjaga kontinuitas gambar dari awal hingga akhir video. Model ini mampu menghasilkan video berdurasi 10 detik yang stabil, tanpa distorsi atau perubahan bentuk objek yang sering menjadi kelemahan AI generatif.

Keunggulan lain yang cukup mencuri perhatian adalah kemampuan audio. Sora 2 tidak hanya menghasilkan visual, tetapi juga menambahkan suara latar, dialog, atau efek lingkungan yang sinkron dengan adegan.

Hasil video bikinan Sora 2 bisa ditonton lewat video di bawah ini.

Baca juga: Demi AI Sora, Induk ChatGPT Siapkan Chip Bikinan Sendiri?

Aplikasi Sora mirip TikTok

App Store Aplikasi Sora tersedia gratis di App Store untuk pengguna iPhone di AS dan Kanada. Aplikasi Sora tersedia gratis di App Store untuk pengguna iPhone di AS dan Kanada.

Bersamaan dengan peluncuran model baru, OpenAI juga menghadirkan aplikasi sosial Sora.","Kompas Cyber Media, Galuh Putri Riyanto, Yudha Pratomo, Shutterstock Via Tom'S Guide, App Store",Model AI terbaru Sora 2 diklaim bisa membuat video yang lebih realistis. Model AI ini bahkan diklaim paham hukum fisika di dunia nyata.
40,2025-09-30,money.kompas.com,https://money.kompas.com/read/2025/09/30/205000426/efisiensi-dan-retensi-begini-cara-ai-dipakai-perusahaan-di-ranah-hr,"Efisiensi dan Retensi, Begini Cara AI Dipakai Perusahaan di Ranah HR","JAKARTA, KOMPAS.com - Persaingan bisnis yang semakin ketat mendorong perusahaan mengadopsi teknologi berbasis kecerdasan buatan atau Artificial Intelligence (AI) dalam pengelolaan sumber daya manusia (SDM).

Mekari Talenta, software Human Capital Management (HCM) end-to-end, mencatat pemanfaatan fitur berbasis AI meningkat dua kali lipat secara tahunan pada 2025.

Head of Business Mekari Talenta, Stevens Jethefer, mengatakan penerapan AI di ranah HR bukan hanya soal otomatisasi, melainkan juga peran strategis dalam mendukung produktivitas dan retensi karyawan.

Baca juga: Potensi Ekonomi Besar, Fintech dan Asuransi Garis Depan Adopsi AI

Freepik/biancoblue ilustrasi artificial intelligence Freepik/biancoblue ilustrasi artificial intelligence

“AI di Mekari Talenta dirancang bukan hanya untuk otomatisasi, tapi juga sebagai HR leaders’ strategic partner untuk empower people’s growth. Kami mengukur dampak setiap fitur terhadap produktivitas, biaya, dan pertumbuhan bisnis,” kata Stevens dalam siaran pers, Selasa (30/9/2025).

Tren AI di Asia Tenggara

Adopsi AI di kawasan Asia Tenggara juga menunjukkan tren meningkat.

Studi Kearney dan McKinsey menyebutkan, 65 persen perusahaan di kawasan ini sudah memanfaatkan AI, dengan potensi kontribusi hingga 1 triliun dollar AS terhadap PDB pada 2030.

Namun, 80 persen dari perusahaan tersebut masih berada pada tahap awal implementasi.

Baca juga: Lufthansa Pangkas 4.000 Pekerjaan, Andalkan AI untuk Tingkatkan Efisiensi

Perusahaan yang berhasil mengoptimalkan AI tercatat mampu meningkatkan produktivitas hingga 40 persen, dan 92 persen di antaranya berencana menambah investasi AI dalam tiga tahun ke depan.

Industri yang paling banyak manfaatkan fitur AI","Kompas Cyber Media, Shutterstock Supatman, Freepik Biancoblue",Persaingan bisnis yang semakin ketat mendorong perusahaan mengadopsi teknologi berbasis kecerdasan buatan atau AI.
41,2025-09-30,money.kompas.com,https://money.kompas.com/read/2025/09/30/165309026/potensi-ekonomi-besar-fintech-dan-asuransi-garis-depan-adopsi-ai,"Potensi Ekonomi Besar, Fintech dan Asuransi Garis Depan Adopsi AI","JAKARTA, KOMPAS.com – Indonesia tengah berada di persimpangan penting dalam peta ekonomi digital Asia Tenggara.

Dengan proyeksi kontribusi kecerdasan buatan (AI) global mencapai 15,7 triliun dollar AS dan potensi lokal hingga 10 persen dari Produk Domestik Bruto (PDB) nasional, pemanfaatan AI bukan lagi sekadar opsi teknologi, tetapi peluang ekonomi strategis.

Perusahaan AI-as-a-Service Dyna.Ai secara resmi meluncurkan operasinya di Indonesia.

Baca juga: Lufthansa Pangkas 4.000 Pekerjaan, Andalkan AI untuk Tingkatkan Efisiensi

canva.com Ilustrasi artificial intelligence (AI). canva.com Ilustrasi artificial intelligence (AI).

Mengusung teknologi Agentic AI, yakni jenis AI yang memahami konteks, mengambil keputusan secara mandiri, dan bertindak intuitif, Dyna.Ai menyasar sektor-sektor dengan beban operasional tinggi dan kebutuhan layanan pelanggan yang kompleks, seperti fintech dan asuransi.

“Indonesia pernah tertinggal dalam revolusi industri sebelumnya. Tapi kali ini kita berada di posisi strategis untuk memimpin Revolusi Nasional AI,” ujar Andreas Tjendra, AI National Roadmap Advisor dalam siaran pers, Selasa (30/9/2025).

Ia mengutip proyeksi Bank Dunia bahwa AI bisa menyumbang hingga 10 persen terhadap PDB Indonesia, mengingat besarnya populasi dan percepatan adopsi digital yang terus berlangsung.

Fintech dan asuransi di garis depan adopsi AI

Dari sisi kesiapan sektor keuangan, Wakil Sekretaris Jenderal II Asosiasi Fintech Indonesia (AFTECH), Saat Prihartono, menyatakan bahwa fintech lokal “beyond ready and beyond aligned” untuk mengadopsi AI.

Baca juga: 5.100 Siswa Jawa Barat Belajar AI, Puncaknya di Hackathon Bandung

Namun, ia tak menutup mata terhadap sejumlah kendala.

“Talenta, infrastruktur, dan keterampilan adopsi masih jadi tantangan. Tapi AI punya potensi besar meningkatkan produktivitas, menyederhanakan proses operasional, dan memperkuat keterlibatan pelanggan,” jelasnya.","Kompas Cyber Media, Freepik","Pemanfaatan AI bukan lagi sekadar opsi teknologi, tetapi peluang ekonomi strategis."
42,2025-09-28,tekno.kompas.com,https://tekno.kompas.com/read/2025/09/28/09020087/chatgpt-pulse-dirilis-asisten-ai-yang-bisa-kasih-update-harian-setiap-pagi,"ChatGPT Pulse Dirilis, Asisten AI yang Bisa Kasih Update Harian Setiap Pagi","KOMPAS.com - OpenAI, perusahaan induk chatbot AI ChatGPT, merilis fitur baru bernama ChatGPT Pulse. Fitur ini hadir sebagai asisten AI yang bertugas membantu memberikan update informasi harian kepada penggunanya.

Adapun jenis informasi yang diberikan fitur ChatGPT Pulse cukup beragam. Mulai dari kelanjutan tugas atau proyek/tugas yang sedang dikerjakan, rekomendasi makan malam, atau saran perjalanan.

Semua informasi tersebut, dikemas dalam bentuk kartu visual berisi ringkasan singkat yang bisa diperluas lagi untuk menampilkan detail yang lebih lengkap.

OpenAI menyebut, fungsi ini dihadirkan sebagai bentuk “personalized research and timely updates"" atau riset yang dipersonalisasi dan pembaruan tepat waktu yang muncul secara berkala.

Baca juga: ChatGPT Go Resmi Hadir di Indonesia, Harga Langganan Lebih Murah

Sederhananya, ini merupakan kondisi di mana ChatGPT kini tidak lagi dibuat ""bekerja"" dengan menunggu perintah si pengguna, melainkan menjadikannya lebih proaktif dengan membiarkan asisten AI memilih informasi mana yang akan disajikan.

Cara kerja ChatGPT Pulse

Seperti disinggung di atas, ChatGPT Pulse mampu memberikan update informasi harian yang relevan kepada penggunanya.

Informasi ini bisa ditampilkan karena Pulse bekerja dengan melakukan riset otomatis dari riwayat percakapan (chat) pengguna atau preferensi yang sudah disimpan di aplikasi ChatGPT.

Apabila pengguna memberikan akses ChatGPT ke aplikasi Gmail dan Google Calendar, maka fitur Pulse bisa menambahkan update informasi dengan konteks yang lebih relevan.

Contoh pemberitahuan yang ditampilkan, yaitu seperti membuat draft agenda rapat, memberi pengingat saat ada acara ulang tahun, menyarankan restoran saat berada di kota lain, dan lain sebagainya.

Baca juga: Studi: ChatGPT Lebih Sering Dipakai untuk Urusan Pribadi Ketimbang Pekerjaan

Nantinya, AI akan memberikan update informasi tersebut saat pagi hari dalam bentuk kartu visual, sebagaimana dihimpun KompasTekno dari media teknologi Arstechnica, Minggu (28/9/2025).

OpenAI Tampilan antarmuka (UI) fitur ChatGPT Pulse, fitur baru OpenAI yang dirancang sebagai asisten AI pengguna yang bisa memberikan update informasi harian secara otomatis di setiap pagi. Tampilan antarmuka (UI) fitur ChatGPT Pulse, fitur baru OpenAI yang dirancang sebagai asisten AI pengguna yang bisa memberikan update informasi harian secara otomatis di setiap pagi.

OpenAI sendiri menyebut mekanisme ini sebagai bentuk “asynchronous research.” Secara sederhana, bentuk ini menjadikan model AI melakukan riset di latar belakang selama semalam menggunakan metode tradisional, lalu menyajikan hasilnya secara otomatis pada pagi hari.

Update yang diberikan Pulse juga diatur agar hanya muncul satu kali dan akan menghilang setelah 24 jam, kecuali jika pengguna memutuskan menyimpan informasi tersebut.

Jika dari informasi yang disajikan tersebut ada pertanyaan lanjutan, maka pemberitahuan tersebut akan berubah menjadi chat standar seperti di dalam aplikasi.

Baca juga: Nvidia-OpenAI Gelontorkan Rp 1.650 Triliun Bangun Pusat Data AI Raksasa

Hal lain yang bisa dilakukan pengguna yaitu memberi umpan balik dengan tombol jempol naik atau turun. Selain itu, ada tombol “curate” untuk meminta AI memberikan topik tertentu yang dirasa lebih sesuai dengan kebutuhan pengguna.

Arah ChatGPT ke depan

Dirilisnya fitur ChatGPT Pulse disebut menjadi bagian dari strategi besar OpenAI yang ingin beralih menuju konsep ""Agentic AI"". Konsep ini merujuk pada kondisi di mana model AI bertindak lebih mandiri dalam batasan tertentu, dan tidak lagi menunggu perintah (prompt) si pengguna.","Kompas Cyber Media, Marsha Bremanda, Reska K. Nistanto, Reuters",ChatGPT Pulse membantu memberikan update informasi harian kepada penggunanya setiap pagi. Informasi apa saja yang bisa disajikan?
43,2025-09-28,nasional.kompas.com,https://nasional.kompas.com/read/2025/09/28/00223341/menlu-di-dewan-keamanan-pbb-penggunaan-ai-harus-untuk-kemanusiaan,Menlu di Dewan Keamanan PBB: Penggunaan AI Harus untuk Kemanusiaan,"JAKARTA, KOMPAS.com - Menteri Luar Negeri RI, Sugiono, menekankan bahwa manusia harus tetap memegang kendali utama atas kecerdasan buatan (AI), yang seharusnya digunakan untuk kepentingan kemanusiaan, bukan untuk menghancurkan.

Hal ini disampaikan Sugiono dalam debat Dewan Keamanan PBB tentang AI dan pengaplikasiannya dalam militer dan keamanan, di New York, Amerika Serikat, Kamis (25/9/2025).

Baca juga: Menlu Sugiono di Forum G20: Perdamaian Fondasi Pembangunan Berkelanjutan

Menurut Sugiono, akan ada kemungkinan malapetaka ketika AI menjadi alat propaganda kepentingan yang bersifat konflik.

""Kemudian Indonesia menyampaikan bahwa kita tetap harus manusia harus tetap menjadi master dan tidak diperbudak ataupun diatur oleh AI,"" kata Sugiono dalam keterangan videonya, Sabtu (27/9/2025).

Sugiono mengatakan, manusia harus tetap memegang kendali utama pemanfaatan AI. Manusia harus menjadi subyek, bukan menjadi obyek, sehingga penggunaan akal imitasi ini berorientasi pada kemanusiaan.

""Kita juga menekankan pentingnya tata kelola multilateral yang inklusif dalam rangka mencerminkan kepentingan seluruh negara dalam kaitan dengan penggunaan AI ini,"" kata Sugiono.

Dia mengatakan, posisi AI saat ini berkembang pesat sehingga memiliki dua mata pisau yang bisa menguntungkan sekaligus membahayakan.

Sebab itu, dia menekankan bahwa kepentingan untuk mensejahterakan manusia adalah pilihan yang paling baik dalam penggunaan AI.

""Indonesia menyampaikan posisinya bahwa perkembangan teknologi artificial intelligence yang berkembang dengan sangat pesat ini selain merupakan suatu kebaikan atau keuntungan, juga memiliki sisi lain yang bisa membahayakan ataupun dipergunakan oleh negara-negara untuk kepentingan-kepentingan di luar kepentingan yang mensejahterakan manusia,"" tutur dia.","Kompas Cyber Media, Singgih Wiryono, Dita Angga Rusiana, Antara Kuntum Riswan","Menteri Luar Negeri RI, Sugiono, menegaskan pentingnya AI untuk kemanusiaan dalam debat Dewan Keamanan PBB. Simak informasinya!"
44,2025-09-27,money.kompas.com,https://money.kompas.com/read/2025/09/27/162547326/perusahaan-bakal-terapkan-ai-di-kedai-kopi-petinggi-starbucks-mengundurkan,"Perusahaan Bakal Terapkan AI di Kedai Kopi, Petinggi Starbucks Mengundurkan Diri","JAKARTA, KOMPAS.com - Salah seorang petinggi Starbucks, yakni Chief Technology Officer, Deb Hall Lefevre menyampaikan pengunduran diri dari perusahaan pada Senin (22/9/2025) lalu.

Pengunduran diri Lefevre ini hampir bersamaan saat Starbucks mengumumkan pemangkasan besar-besaran pada peran korporat di perusahaan pada Jumat (26/9/2025).

Dilansir Reuters, Sabtu (27/9/2025), pengunduran diri Lefevre disampaikan lewat memo internal kepada staf perusahaan.

Baca juga: Usai Umumkan PHK 900 Karyawan, Starbucks Ungkap Rencana Ekspansi di 2026

Dalam memo yang sama juga dikabarkan bahwa manajemen menunjuk Ningyu Chen yang sebelumnya merupakan wakil presiden senior teknologi pengalaman global untuk menggantikan posisi Lefevre secara sementara.

""Prioritas teknologi kami tidak berubah. Kami berfokus pada pekerjaan teknologi yang dibutuhkan untuk mewujudkan misi 'Kembali ke Starbucks',"" demikian tulis memo tersebut.

Lefevre sendiri merupakan mantan eksekutif McDonald's yang direkrut Starbucks pada Mei 2022 untuk meningkatkan sistem layanan drive-through, pemesanan seluler, dan lainnya.

Masih dalam memo yang sama, disebutkan Lefevre telah berencana melakukan pensiun.

Baca juga: Starbucks PHK 900 Karyawan, Imbas Penutupan Gerai dan Turunnya Penjualan

Ganti karyawan dengan AI

CEO Starbucks Brian Niccolo pada Jumat membuat pernyataan mendorong perombakan teknologi di kedai-kedai untuk membuat tenaga kerja lebih efisien.

Efisiensi itu menjadi bagian dari strategi restrukturisasi untuk menghidupkan kembali penjualan Starbucks yang lesu setelah enam kuartal berturut-turut mengalami penurunan.","Kompas Cyber Media, Dian Erika Nugraheny, Teuku Muhammad Valdy Arief, Pexels Dom J",Pengunduran diri Lefevre ini hampir bersamaan saat Starbucks mengumumkan pemangkasan besar-besaran pada peran korporat di perusahaan.
45,2025-09-26,www.kompas.com,https://www.kompas.com/tren/read/2025/09/26/193000865/partai-politik-di-jepang-usul-ai-jadi-pemimpin-partai-usai-kalah-pemilu,Partai Politik di Jepang Usul AI jadi Pemimpin Partai Usai Kalah Pemilu,"KOMPAS.com - Salah satu partai politik di Jepang berencana menjadikan kecerdasan buatan (AI) sebagai pemimpin partainya.

Partai tersebut adalah partai baru Path to Rebirth. Mereka berencana untuk menunjuk chatbot penguin sebagai pemimpin AI mereka. Hal itu mereka sampaikan pada pertengahan September 2025 lalu.

Rencana ini berangkat dari hasil pemilu di wilayah tersebut yang ternyata menunjukkan hasil mengecewakan di mana partai tidak mendapat kursi sama sekali di pemerintahan.

Koki Okumura (25) yang memenangkan pemilihan pemimpin partai Path to Rebith justru berniat menyerahkan kepemimpinan partai kepada AI.

“Pemimpin baru akan berupa AI. Partai akan mempercayakan pengambilan keputusan kepada AI,” ujar Okumura yang juga merupakan spesialis dalam riset AI melalui pengumumannya dalam konferensi pers di Minato Ward, Tokyo, Rabu (27/8/2025).

Baca juga: 12 Prompt AI Gabungkan Foto Masa Kecil dan Sekarang, Gratis dan Bisa Lewat HP

AI pimpin pengambilan keputusan partai

Ide mengenai AI yang akan menjabat sebagai pemimpin partai tersebut diusulkan oleh kandidat pemimpin partai terpilih, Koki Okumura, yang merupakan seorang mahasiswa dari Universitas Kyoto.

Okumura menjelaskan walau terpilih sebagai pemimpin partai, ia akan tetap meminta AI yang memimpin partai tersebut. Sedangkan, Okumura akan berperan sebagai asistennya.

Okumura merencakanan AI tersebut nantinya akan berbentuk penguin, yang dibuat sebagai wujud penghormatan kepada masyarakat Jepang yang sangat mencintai hewan.

Baca juga: Tren Edit Foto dengan AI, Pakar Siber Ingatkan Risikonya: Termasuk Kemungkinan Masuk Dark Web

AI tersebut nantinya akan mengambil alih proses pengambilan keputusan terkait operasional partai.

“Saya percaya AI memiliki potensi untuk mencapai sesuatu dengan presisi dan keakuratan lebih tinggi dibanding manusia. Dengan penggunaan AI, pengambilan keputusan dapat tetap mempertimbangkan suara-suara yang sebelumnya mungkin sering diabaikan. Hal ini juga berpotensi menciptakan lingkungan partisipasi politik yang lebih inklusif dan manusiawi,” kata Okumura, dikutip dari CNN, Jumat (19/9/2025)

Sementara itu, alasan mengapa ia tetap harus menjabat sebagai pemimpin partai sebab pemilu di Jepang mengharuskan kandidatnya adalah seorang warga negara Jepang.

“Secara hukum, wakil partai harus berupa orang nyata. Jadi secara formal, manusia tetap menjabat sebagai wakil partai,” kata Okumura.

Baca juga: Psikolog Sebut Ada Manfaat Ikuti Tren Foto AI Gabungan Masa Kecil dan Sekarang, tapi...

Belum pasti kapan AI mulai menjabat

Sementara itu, saat ini belum ada waktu pasti kapan AI tersebut akan mulai 'menjabat'. Okumura menyebut bahwa komite persiapan sedang dibentuk. Penampilan penguin itu juga belum diungkapkan.

Menurut situs web, partai tersebut memiliki keyakinan bahwa siapapun yang tertarik pada politik harus memiliki kesempatan.

Pendiri partai Path to Rebith, Shinji Ishimaru, sekaligus pemimpin partai sebelum ia mengundurkan diri, mendirikan partai tersebut pada Januari 2025.","Kompas Cyber Media, Fatimah Az Zahra, Resa Eka Ayu Sartika, Chatgpt","Partai baru Jepang, Path to Rebirth, berencana menjadikan AI berbentuk penguin sebagai pemimpin simbolisnya setelah gagal meraih kursi dalam pemilu."
46,2025-09-25,www.kompas.com,https://www.kompas.com/global/read/2025/09/25/203725670/rusia-dukung-seruan-trump-larang-senjata-biologis-global,Rusia Dukung Seruan Trump Larang Senjata Biologis Global,"MOSKWA, KOMPAS.com - Rusia menyatakan dukungan atas seruan Presiden Amerika Serikat (AS) Donald Trump yang memberlakukan larangan global untuk penggunaan senjata biologis.

Juru bicara Kremlin Dmitry Peskov pada Kamis (25/9/2025) menyebut usulan Trump sebagai “seruan yang sangat penting” dan “inisiatif yang brilian”.

“Secara alami, pihak Rusia siap untuk berpartisipasi dalam proses pelarangan semacam itu, pelarangan umum terhadap senjata biologis, dan tentu saja, akan baik jika hal ini dapat diformalkan, sekali lagi di tingkat internasional,” ujar Peskov sebagaimana yang dilansir dari Reuters pada Kamis (25/9/2025).

Baca juga: Korea Utara Tuding AS Buat Senjata Biologis di Ukraina

Sebelumnya, dalam pidatonya di Perserikatan Bangsa-Bangsa (PBB) pada Selasa (23/9/2025), Trump menyerukan larangan menyeluruh atas pengembangan senjata biologis.

Ia juga mengusulkan agar Kecerdasan Buatan (Artificial Intelligence/AI) dapat dimanfaatkan untuk memverifikasi kepatuhan antarnegara.

Trump mengatakan, “Saya mengajak setiap negara untuk bergabung dengan kami dalam mengakhiri pengembangan senjata biologis untuk selamanya.”

Baca juga: Rusia Akan Angkat Klaim Kepemilikan Laboratorium Senjata Biologis AS di Ukraina pada Pertemuan PBB","Kompas Cyber Media, Shintaloka Pradita Sicca, Shutterstock",Rusia menyambut baik seruan Presiden AS Donald Trump untuk melarang senjata biologis secara global dalam forum PBB.
