id,date,source,url,title,content,authors,summary
17,2025-09-28,www.kompas.com,https://www.kompas.com/tren/read/2025/09/28/193000965/ternyata-ai-juga-bisa-berhalusinasi-seperti-apa-bentuknya-,"Ternyata AI Juga Bisa Berhalusinasi, Seperti Apa Bentuknya?","KOMPAS.com - Halusinasi adalah kesalahan persepsi seseorang terhadap objek atau peristiwa yang melibatkan indra, baik penglihatan, penciuman, pendengaran, sentuhan, maupun rasa.

Tidak hanya manusia, kecerdasan buatan (AI) juga ternyata bisa mengalami halusinasi, terutama pada model bahasa besar atau large language model (LLM).

Namun, apa yang dialami mesin AI tentu jauh berbeda dengan halusinasi yang dirasakan oleh manusia.

Penggunaan kata “halusinasi” hanya sebagai istilah untuk menggambarkan bentuk kesalahan yang dilakukan oleh AI yang mirip dengan kondisi tertentu pada AI.

Baca juga: AI Jadi Menteri di Albania, Bagaimana Status Hukumnya?





Apa itu halusinasi pada AI?

Halusinasi AI adalah pernyataan atau hasil yang tampak masuk akal namun salah, yang dihasilkan oleh model bahasa (language model).

Dikutip dari laman IBM, halusinasi AI merupakan fenomena di mana model bahasa besar (LLM), sering kali chatbot AI generatif atau alat visi komputer, mempersepsikan pola atau objek yang tidak ada atau tidak dapat diamati oleh pengamat manusia.

Sehingga kondisi tersebut menghasilkan keluaran yang tidak masuk akal atau sama sekali tidak akurat.

Baca juga: Kontroversi Artificial Intelligence dan Penegakan Hukum

Umumnya, jika pengguna mengajukan permintaan ke AI generatif, mereka menginginkan keluaran yang sesuai dengan permintaan, atau jawaban yang benar atas pertanyaan.

Namun, kadang algoritma AI menghasilkan keluaran yang tidak didasarkan pada data pelatihan, didekode secara salah oleh transformer, atau tidak mengikuti pola yang dapat diidentifikasi. Dengan kata lain, AI ""berhalusinasi"" terhadap respons tersebut.

Istilah halusinasi mungkin terdengar paradoks, mengingat kondisi ini biasanya dikaitkan dengan otak manusia atau hewan, bukan mesin.

Baca juga: Bagaimana Seharusnya Artificial Intelligence (AI) Dikembangkan?

Namun, dari sudut pandang metaforis, halusinasi secara akurat menggambarkan hal ini, terutama dalam hal pengenalan gambar dan pola.

Halusinasi AI mirip dengan bagaimana manusia terkadang melihat bentuk sesuatu di awan atau wajah di bulan.

Mengapa AI “berhalusinasi”?

Unsplash/Jonathan Kemper Halusinasi AI pada model bahasa besar atau large language model (LLM). Halusinasi AI pada model bahasa besar atau large language model (LLM).

Dalam kasus AI, kesalahan interpretasi ini terjadi karena berbagai faktor, termasuk overfitting, bias/ketidakakuratan data pelatihan, dan kompleksitas model yang tinggi.

Menurut sebuah makalah penelitian bertajuk Why Language Models Hallucinate (2025), model bahasa mengalami halusinasi karena prosedur pelatihan dan evaluasi standar lebih mengutamakan tebakan daripada mengakui ketidakpastian.","Kompas Cyber Media, Muhammad Zaenuddin, Akamai, Unsplash Jonathan Kemper","Tidak hanya manusia, AI juga ternyata bisa mengalami halusinasi, terutama pada model bahasa besar atau large language model (LLM). Seperti apa?"
18,2025-09-26,tekno.kompas.com,https://tekno.kompas.com/read/2025/09/26/15350017/kenapa-foto-gemini-ai-tidak-cocok-dengan-yang-kita-inginkan-ini-penyebabnya-,Kenapa Foto Gemini AI Tidak Cocok dengan yang Kita Inginkan? Ini Penyebabnya,"KOMPAS.com - Belakangan ini, tren foto AI dari Gemini AI semakin populer di media sosial. Pengguna bisa berkreasi dengan berbagai gaya, mulai dari potret ala studio profesional, foto keluarga dengan nuansa hangat, hingga berpose bersama idola favorit.

Cukup dengan mengetikkan prompt tertentu, hasil foto yang unik dan estetik pun bisa langsung muncul tanpa perlu repot datang ke studio. Namun, di balik kemudahannya, banyak pengguna yang justru merasa hasil foto AI tidak sesuai dengan ekspektasi.

Misalnya, ketika sudah menuliskan detail permintaan agar pakaian berwarna pastel biru, hasil akhirnya malah berbeda warna atau detailnya terlihat kurang natural. Fenomena ini membuat banyak orang bertanya-tanya, sebenarnya apa yang membuat foto dari Gemini AI sering tidak cocok dengan keinginan kita? Selengkapnya KompasTekno menguraikan penyebab dan cara mengatasinya.

Baca juga: 20 Contoh Prompt Gemini AI Foto Studio Bareng Keluarga, Menarik Dicoba

Prompt kurang jelas atau rumit

Prompt adalah “naskah” utama yang dibaca AI sebelum menghasilkan gambar. Jika prompt yang Anda tulis terlalu samar, bertele-tele, atau bahkan kontradiktif, AI bisa salah tafsir. Misalnya, menulis “gunung uang yang rapi dan acak” jelas membingungkan karena ada dua arahan yang saling bertolak belakang. Akibatnya, hasil gambar jadi tidak sesuai harapan.

Cara mengatasinya, Anda bisa menulis prompt sejelas mungkin dengan detail yang terfokus, mulai dari objek utama, warna, pencahayaan, hingga gaya gambar yang diinginkan. Lebih baik mulai dari deskripsi sederhana, lalu secara bertahap tambahkan detail tambahan. Dengan begitu, AI punya arahan yang jelas untuk mengikuti imajinasi Anda.

Lupa menggunakan negative Prompt

Selain memberi tahu AI apa yang harus ditampilkan, penting juga memberi tahu apa yang harus dihindari. Inilah fungsi negative prompt. Tanpa arahan ini, AI kerap menambahkan elemen yang tak diinginkan, seperti background acak, detail wajah yang aneh, atau warna yang berbeda dari permintaan.

Bayangkan Anda ingin foto keluarga yang formal, tapi hasilnya justru muncul kursi tambahan atau warna pakaian yang tidak konsisten.

Maka dari itu, untuk mengatasinya gunakan kata kunci penghindar sesuai masalah yang sering muncul.

Misalnya, tambahkan “blurry, low quality, pixelated” jika hasil foto cenderung buram, atau “cartoonish” jika Anda ingin gaya realistis. Semakin teliti Anda menyusun negative prompt, semakin bersih hasil akhir yang dihasilkan AI.

Resolusi gambar terlalu rendah

Meski prompt sudah ditulis dengan sempurna, hasil foto bisa tetap mengecewakan jika resolusinya rendah. Gambar akan terlihat buram, detail wajah tidak jelas, atau tekstur objek jadi hilang. Hal ini sering terjadi jika pengguna hanya memakai resolusi standar kecil karena keterbatasan perangkat atau sekadar ingin hasil cepat.

Untuk mengatasinya, pengguna bisa menggunakan resolusi sedang sebagai titik awal, misalnya 1024×1024. Jika Anda menginginkan detail yang lebih kompleks, seperti lipatan kain pada pakaian atau tekstur kulit yang natural, maka naikkan ke resolusi lebih tinggi, misalnya 1536×1024.

Perlu diingat, semakin tinggi resolusi, semakin besar beban pada perangkat. Maka dari itu, , sebaiknya uji coba dulu di resolusi kecil sebelum menaikkannya.

Efek dinamis terlalu kompleks

AI memang canggih, tapi masih sering kesulitan menampilkan gerakan atau efek yang rumit. Permintaan seperti air mengalir deras, asap berputar di udara, atau koin berjatuhan bisa membuat hasil gambar terlihat janggal.

Jika pengguna menambahkan terlalu banyak efek dinamis sekaligus, gambar justru menjadi berantakan, tidak fokus, atau terlihat tidak alami. Adapun cara mengatasinya, Anda bisa mencoba dengan mengutamakan satu efek utama yang paling penting. Misalnya, jika ingin menampilkan koin berjatuhan, cukup tambahkan detail seperti “motion blur” atau “dynamic composition.”

Jangan sekaligus menambahkan efek asap, kilatan cahaya, dan latar bergerak, karena AI cenderung gagal meramu semuanya. Fokus pada satu elemen dinamis akan membuat hasil lebih konsisten dan realistis.

Post-Processing

Banyak orang berharap hasil dari AI langsung sempurna, padahal nyatanya AI hanya menghasilkan gambar mentah. Tanpa sentuhan akhir, hasil foto bisa terlihat datar, pencahayaan kurang pas, atau warna tampak pucat. Inilah mengapa banyak pengguna merasa kecewa karena foto AI tidak sebagus yang mereka bayangkan.

Maka dari itu Anda bisa melakukan post-processing dengan aplikasi editing. Anda bisa memanfaatkan Photoshop atau GIMP untuk menyesuaikan detail dan pencahayaan, Canva untuk menambahkan teks atau elemen grafis, hingga After Effects jika ingin memasukkan efek dinamis.

Dengan sedikit polesan, gambar AI yang awalnya “biasa saja” bisa berubah menjadi karya visual yang jauh lebih profesional.

Demikian ulasan mengenai beberapa penyebab mengapa foto Gemini AI tidak cocok dengan yang diinginkan. Semoga membantu.

Baca juga: Google Sulap Chrome Jadi Browser Gemini AI, Ini 10 Fitur Canggihnya

Dapatkan update berita teknologi dan gadget pilihan setiap hari. Mari bergabung di Kanal WhatsApp KompasTekno. Caranya klik link https://whatsapp.com/channel/0029VaCVYKk89ine5YSjZh1a. Anda harus install aplikasi WhatsApp terlebih dulu di ponsel.","Kompas Cyber Media, Soffya Ranti, Kompas.Com Soffyaranti","Foto Gemini AI sering meleset karena prompt, resolusi, efek kompleks, hingga kurang editing."
19,2025-09-24,www.kompas.com,https://www.kompas.com/cekfakta/read/2025/09/24/164200382/-hoaks-polisi-brasil-menyembunyikan-mayat-istrinya-selama-15-tahun,[HOAKS] Polisi Brasil Menyembunyikan Mayat Istrinya Selama 15 Tahun,"hoaks! Berdasarkan verifikasi Kompas.com sejauh ini, informasi ini tidak benar.

KOMPAS.com - Tersiar kisah seorang polisi di Anapolis, Brasil menyembunyikan mayat istrinya di dinding rumah selama 15 tahun.

Perempuan tersebut bernama Vitoria Mendes yang bekerja sebagai guru sekolah.

Ia dilaporkan menghilang pada 1995 dan baru ditemukan di dinding rumahnya saat renovasi 15 tahun kemudian.

Narasi itu tidak benar atau merupakan hoaks. Simak penelusuran Tim Cek Fakta Kompas.com berikut.

Narasi yang beredar

Kisah seorang polisi di Brasil menyembunyikan mayat istrinya selama 15 tahun disebarkan oleh akun Facebook ini, ini, ini, ini, dan ini.

Pengunggah menyertakan gambar kerangka manusia yang dikubur di dinding dan foto pasangan suami istri.

Berikut teks yang tertera pada gambar:

seorang polisi menyembunyikan istrinya selama 15 tahun dan ketahuan saat renovasi rumah dilakukan

Sementara, berikut narasi yang ditulis salah satu akun pada Rabu (17/9/2025):

Terkvbur dalam Keheningan selama 15 tahun

Bagaimana Seorang Kepala Polisi Menyembunyik4n Nasib Istrinya Selama 15 Tahun.

Di kota Anapolis, Goias yang tenang, sebuah misteri terpendam selama lebih dari satu dekade, dibisikkan dari generasi ke generasi seolah-olah itu adalah kisah h4ntu.

K4sus Vitoria Mendes, seorang guru sekolah yang berdedikasi yang menghil4ng pada tahun 1995 dengan duk4 dan spekulasi.

Selama 15 tahun, kepergiannya adalah luk4 yang tak kunjung sembuh—sampai sebuah renovasi sederhana mengungkap rahasia yang selama ini tersembunyi di dalam rumahnya sendiri.

akun Facebook Tangkapan layar konten hoaks di sebuah akun Facebook, Rabu (17/9/2025), mengenai kisah seorang polisi di Brasil menyembunyikan mayat istrinya selama 15 tahun. akun Facebook Tangkapan layar konten hoaks di sebuah akun Facebook, Rabu (17/9/2025), mengenai kisah seorang polisi di Brasil menyembunyikan mayat istrinya selama 15 tahun.

Penelusuran Kompas.com

Tidak ditemukan berita atau laporan valid mengenai orang hilang bernama Vitoria Mendes di Anapolis.","Kompas Cyber Media, Rosy Dewi Arianti Saptoyo, Kompas.Com Akbar Bhayu Tamtomo, Akun Facebook",Tidak ada laporan atau berita kredibel soal seorang polisi di Brasil menyembunyikan mayat istrinya selama 15 tahun. Simak penelusuran faktanya.
20,2025-09-23,tekno.kompas.com,https://tekno.kompas.com/read/2025/09/23/19070087/bos-chatgpt-akui-ai-bisa-picu-phk-ini-pekerjaan-yang-rentan-diganti-ai,"Bos ChatGPT Akui AI Bisa Picu PHK, Ini Pekerjaan yang Rentan Diganti AI","KOMPAS.com - CEO OpenAI, Sam Altman, mengakui bahwa kehadiran kecerdasan buatan (AI) berpotensi memicu gelombang pemutusan hubungan kerja (PHK) di sejumlah sektor.

Menurut orang nomor satu di balik perusahaan chatbot AI populer ChatGPT tersebut, ada beberapa jenis pekerjaan yang dinilai sangat rentan digantikan oleh teknologi AI, salah satunya yaitu customer service.

Dalam wawancaranya di acara The Tucker Carlson Show baru-baru ini, Altman menyebut bahwa pekerjaan di sektor layanan pelanggan tersebut menjadi salah satu yang paling mudah diotomatisasi AI.

""Saya yakin bahwa banyak layanan pelanggan saat ini yang dilakukan melalui telepon atau komputer, akan membuat orang-orang tersebut kehilangan pekerjaan, dan hal itu akan lebih mudah dilakukan oleh AI,” kata Altman, seperti dikutip KompasTekno dari Tech Radar, Selasa (23/9/2025).

Baca juga: Ketika PHK Karyawan demi AI Berujung Blunder dan Penyesalan

Selain customer service, Altman juga memperkirakan ada dua pekerjaan lain yang menurutnya bisa dengan mudah digantikan oleh AI. Pekerjaan tersebut datang dari sektor IT, seperti programmer dan developer.

Kekhawatiran Altman sendiri cukup masuk akal. Mengingat saat ini beberapa model AI populer memang sudah bisa membantu pengguna menulis, mengoreksi, bahkan mengoptimalkan kode pemrograman dengan tingkat akurasi baik.

Resah dengan ciptaannya

Dalam kesempatan yang sama, Altman juga mengungkapkan betapa besar kekhawatiran yang ia rasakan terkait dampak AI terhadap pekerja manusia.

Ia mengaku dirinya sampai sering sulit tidur karena memikirkan bagaimana teknologi ciptaannya ternyata bisa benar-benar menggantikan pekerjaan manusia.

Altman menyebut, yang membuat dirinya resah bukan hanya soal ""seseorang"" yang kehilangan pekerjaan, tapi juga keputusan-keputusan kecil dalam perilaku AI yang bisa berdampak langsung pada kehidupan mereka.

Baca juga: Sering Curhat dengan ChatGPT? Hati-hati, Ini Kata Sam Altman

Sebagai CEO OpenAI, Altman mengaku bahwa dirinya mulai merasakan beratnya tanggung jawab etika dan moral atas konsekuensi yang dialami jutaan orang ketika lapangan kerja mereka digantikan oleh AI.

canva.com ilustrasi AI menggantikan pekerjaan manusia. ilustrasi AI menggantikan pekerjaan manusia.

Kekhawatiran yang dirasakan Altman datang bukan tanpa alasan. Pasalnya, beberapa perusahaan besar kini sudah mulai mengadopsi AI untuk menggantikan tenaga kerja manusia.

Perusahaan Salesforce, misalnya, belum lama ini dilaporkan memangkas sekitar 4.000 karyawan di divisi customer support. Kabarnya, pemangkasan ini dilakukan sebagai bentuk efisiensi karena perusahaan ingin beralih menggunakan AI ke dalam layanannya.

Baca juga: Salesforce PHK 4.000 Karyawan, Perannya Diambil Alih AI

CEO Salesforce, Marc Benioff, bahkan berpendapat bahwa para pemimpin perusahaan di masa depan seharusnya tidak boleh terus mengelola tim manusia, tapi juga harus mampu mengatur ""tim digital"" yang terdiri dari agen AI.

AI percepat transformasi pekerjaan

Masih di wawancara yang sama, Altman sendiri memberikan sedikit penjelasan terkait fenomena pergeseran pekerjaan karena AI. Menurutnya, transformasi jenis pekerjaan yang sepenuhnya tergantikan AI, bukanlah fenomena baru.

Dari studi yang ia pelajari, pada dasarnya ada sekitar 50 jenis pekerjaan yang dipastikan akan mengalami perubahan signifikan dalam kurun waktu 75 tahun atau lebih.

Namun dengan adanya AI, kurun waktu tersebut diperkirakan bergerak jauh lebih cepat. Sehingga, dampaknya adalah para pekerja jadi hanya memiliki sedikit waktu untuk beradaptasi dan menghadapi perubahan tersebut.

Kendati demikian, Altman menegaskan bahwa tidak semua jenis pekerjaan bisa digantikan oleh AI.

Ia mencontohkan, profesi yang membutuhkan keterampilan empati dan interaksi manusia, seperti perawat atau tenaga kesehatan, dianggap lebih aman dari ancaman otomatisasi AI.","Kompas Cyber Media, Marsha Bremanda, Wahyunanda Kusuma Pertiwi, Getty Images","Sam Altman, CEO OpenAI, perusahaan induk ChatGPT mengakui bahwa AI bisa membuat karyawan terdampak PHK. Ada beberapa pekerjaan yang rentan diganti AI."
21,2025-09-23,www.kompas.com,https://www.kompas.com/sains/read/2025/09/23/124405023/ilusi-ai-antara-realitas-rekayasa-dan-disinformasi,"Ilusi AI: Antara Realitas, Rekayasa, dan Disinformasi","KECERDASAN artifisial (AI) kini menjadi kata kunci yang mendefinisikan era digital. Dari mesin pencari, aplikasi penerjemah, hingga perangkat generatif yang mampu membuat gambar dan teks dengan presisi tinggi, AI menghadirkan janji efisiensi dan inovasi. Namun, di balik pesonanya, AI juga menghadirkan sisi gelap berupa ilusi—suatu kabut tipis yang membuat masyarakat sulit membedakan antara realitas dan rekayasa.

Fenomena AI hallucination atau halusinasi AI menggambarkan bagaimana mesin sering kali “mengarang fakta” seolah-olah benar. Mesin bisa menampilkan data yang meyakinkan, lengkap dengan referensi yang tampak ilmiah, tetapi pada kenyataannya tidak pernah ada.

Ilusi ini menjadi lebih berbahaya ketika bersentuhan dengan rendahnya literasi digital masyarakat. Informasi palsu yang diproduksi AI dapat menyebar begitu cepat, menimbulkan kebingungan, bahkan polarisasi sosial. Kita pun menghadapi risiko munculnya “realitas semu” yang dibangun bukan oleh pengalaman manusia, melainkan oleh algoritma.

Baca juga: 32 Cara AI Bisa “Ngawur”, Mirip Gangguan Mental pada Manusia

Disinformasi yang dipacu AI sebenarnya bukan fenomena baru. Sejarah mencatat bahwa teknologi selalu membawa potensi manipulasi—dari propaganda radio, televisi, hingga media sosial. Namun, kecepatan dan kualitas rekayasa yang ditawarkan AI menjadikan tantangan ini berbeda.

Video palsu (deepfake) yang menampilkan tokoh publik dapat memicu krisis kepercayaan, sementara teks yang disusun AI bisa memperkuat bias dan stereotip tanpa dasar. Masyarakat akhirnya hidup dalam banjir informasi yang sulit diverifikasi.

Meski demikian, ilusi yang lahir dari AI tidak semata-mata negatif. Dalam seni, pendidikan, atau riset ilmiah, AI justru membuka ruang imajinasi baru. Misalnya, simulasi berbasis AI dapat membantu mahasiswa memahami konsep abstrak, atau karya seni generatif dapat menantang batas kreativitas manusia. Dengan kata lain, AI mampu menciptakan ruang eksperimen yang memperkaya budaya dan pengetahuan.

Baca juga: Jika AI Memiliki Kehendak Bebas, Siapa yang Tanggung Jawab Kalau ada Kesalahan?

Persoalannya kemudian bukan pada teknologinya, melainkan pada bagaimana kita mengelola dan menempatkan AI dalam kehidupan sosial. Di sinilah peran regulasi, literasi, dan etika menjadi sangat krusial.

Negara perlu hadir dengan kebijakan yang jelas mengenai penggunaan AI, terutama dalam konteks media, pendidikan, dan politik. Akademisi dan praktisi teknologi harus memastikan sistem AI lebih transparan, sementara media massa wajib menjaga standar verifikasi agar tidak terjebak dalam jebakan halusinasi digital.

Lebih dari itu, masyarakat saat ini harus diperlengkapi dengan kemampuan kritis menghadapi banjir informasi. Literasi digital bukan lagi sekadar kemampuan teknis menggunakan gawai, melainkan kecakapan menilai kredibilitas informasi, mengenali potensi manipulasi, dan memahami logika di balik algoritma.

AI seharusnya menjadi alat yang memperkuat daya pikir manusia, bukan menggantikannya. Jika kita gagal menjaga keseimbangan ini, risiko terbesar adalah terciptanya masyarakat yang hidup dalam kabut halusinasi kolektif, di mana fakta dan fiksi bercampur tanpa batas.

Tantangan terbesar kita saat ini adalah memastikan teknologi tetap menjadi sarana emansipasi, bukan penjara ilusi. Dengan demikian, AI harus ditempatkan bukan hanya sebagai mesin cerdas, melainkan juga sebagai cermin yang mengingatkan kita akan pentingnya daya kritis manusia.

Tanpa itu, kita mungkin saja hidup di era paling maju secara teknologi, tetapi sekaligus paling rapuh dalam membedakan kenyataan dari rekayasa.

Baca juga: Mengapa Chatbot AI Menggunakan Begitu Banyak Energi?","Kompas Cyber Media, Fajar Setyaning Dwi Putra, Shutterstock",Fenomena AI hallucination atau halusinasi AI menggambarkan bagaimana mesin sering kali “mengarang fakta” seolah-olah benar.
22,2025-09-23,tekno.kompas.com,https://tekno.kompas.com/read/2025/09/23/10150047/20-contoh-kata-kata-gemini-ai-foto-studio-bareng-keluarga-tinggal-copas-,"20 Contoh Kata-kata Gemini AI Foto Studio Bareng Keluarga, Tinggal “Copas”","KOMPAS.com - Belakangan ini, tren foto ala studio dengan Gemini AI sedang viral di media sosial. Banyak pengguna membagikan hasil kreasi mereka. Mulai dari potret pribadi, foto pasangan, hingga momen kebersamaan dengan keluarga, yang tampak begitu realistis layaknya hasil jepretan fotografer profesional di studio.

Salah satu yang paling diminati adalah foto studio keluarga dengan Gemini AI. Hanya dengan memasukkan beberapa kata-kata perintah, pengguna bisa mengubah foto bersama orang tua, saudara, atau anggota keluarga lainnya menjadi potret layaknya difoto di studio.

Hasilnya bisa dibuat formal dengan jas dan gaun, atau santai dengan pakaian kasual, bahkan ditambah aksesori serta properti untuk menambah kesan natural.

Menariknya, Gemini kini juga menghadirkan alat baru, yakni Gemini 2.5 Flash Image dan Nano Banana, yang memungkinkan pengguna mengolah foto lama menjadi gambar baru tanpa mengubah detail wajah.

Jadi, ekspresi dan identitas tetap sama, hanya tampilannya yang dibuat lebih estetik dengan sentuhan ala studio. Melalui prompt yang tepat, pengguna dapat mengatur suasana, gaya berpose, pencahayaan, hingga latar belakang sesuai keinginan.

Misalnya, membuat keluarga berpose di studio dengan latar putih polos, menghadirkan nuansa hangat di ruang tamu modern, atau gaya ceria dengan properti tambahan seperti balon dan bunga.

Nah, jika Anda tertarik mencobanya, berikut KompasTekno rangkum beberapa contoh kata-kata prompt Gemini AI foto studio bareng keluarga yang bisa dipakai untuk menghasilkan potret unik dan menarik.

Baca juga: 20 Contoh Prompt Gemini AI Foto Studio Bareng Keluarga, Menarik Dicoba

Kata-kata Gemini AI foto studio bareng keluarga

Prompt 1

Ubah foto ini menjadi potret keluarga di studio. Pertahankan wajah asli setiap anggota. Atur pose berdiri berjajar rapi, orang tua di belakang, anak-anak di depan. Ganti pakaian dengan setelan jas hitam untuk ayah, gaun elegan warna navy untuk ibu, serta kemeja putih dan gaun pastel untuk anak-anak. Pencahayaan softbox merata, latar putih polos.

Prompt 2

Edit foto ini menjadi potret keluarga di studio. Pertahankan wajah asli. Atur pose duduk bersama di lantai, saling merangkul dengan ekspresi ceria. Ganti pakaian dengan kaos putih polos dan celana jeans untuk seluruh anggota keluarga. Pencahayaan lembut hangat, latar pastel biru muda. Tambahkan properti balon warna-warni di sekitar.

Prompt 3

Ubah foto ini menjadi foto keluarga di studio. Wajah tetap sama. Atur pose duduk di sofa, ayah dan ibu duduk bersebelahan, anak kecil dipangku. Ganti pakaian dengan busana semi-formal warna senada (beige, cokelat muda, putih). Pencahayaan hangat natural, latar krem polos. Tambahkan properti vas bunga kecil di samping.

Prompt 4

Edit foto ini menjadi foto keluarga di studio. Pertahankan wajah setiap anggota. Atur pose berdiri elegan, ayah memegang pundak ibu, anak-anak berdiri di depan dengan posisi anggun. Ganti pakaian dengan gaun malam merah untuk ibu, jas hitam untuk ayah, serta pakaian pesta anak-anak. Spotlight dramatis, latar hitam dengan sedikit efek cahaya.

Prompt 5

Edit foto ini menjadi potret keluarga di studio. Wajah tetap sama. Atur pose duduk berbaris di kursi kayu, semua anggota menatap kamera dengan ekspresi tenang. Ganti pakaian dengan busana seragam turtle neck hitam polos. Pencahayaan satu sisi untuk efek bayangan artistik, latar biru gelap polos. Minimalis dan elegan.

Prompt 6

Ubah foto ini menjadi foto keluarga di studio. Wajah jangan diubah. Ayah duduk di kursi dengan kemeja putih lengan panjang dan dasi biru. Ibu berdiri di belakang dengan gaun panjang pastel pink. Anak laki-laki duduk di samping ayah dengan kaos polo biru muda, tersenyum lebar. Anak perempuan duduk di pangkuan ibu dengan gaun kuning ceria. Latar putih polos dengan pencahayaan high-key.

Prompt 7

Edit foto ini menjadi potret keluarga di studio. Wajah jangan diubah. Kakek duduk di kursi besar dengan batik cokelat, tersenyum hangat. Nenek duduk di sebelah dengan kebaya hijau lembut. Ayah berdiri di samping kakek dengan jas hitam. Ibu berdiri di samping nenek dengan gaun merah maroon. Dua anak duduk di depan di atas karpet, memakai pakaian kasual jeans dan kemeja putih. Latar klasik abu-abu dengan curtain elegan, pencahayaan soft.

Prompt 8

Ubah foto ini menjadi foto keluarga di studio. Wajah jangan diubah. Ayah duduk di sofa dengan jas biru navy, ekspresi tenang. Ibu duduk di samping dengan gaun biru muda senada. Anak perempuan berdiri di belakang sofa dengan gaun putih, memeluk ayah dari belakang. Anak laki-laki duduk di karpet depan sofa dengan mainan kecil. Latar polos krem, pencahayaan natural lembut.","Kompas Cyber Media, Soffya Ranti, Kompas.Com Zulfikar Hardiansyah","Buat foto keluarga ala studio dengan Gemini AI, cukup copas prompt atau kreasikan kata-kata sendiri."
